{
  "contract_version": "1.0",
  "record_id": "018f0f70-5f1f-7b82-8d28-58a0f6ef370b",
  "revision_id": "018f0f70-66aa-7f89-a7b3-8c8757340399",
  "revision": 1,
  "room_id": "018f0f6e-7b6a-7c10-8af1-7f4c620b93c1",
  "kind": "persona",
  "scope": {"persona_id": "018f0f6e-bbc1-78c1-a23a-46588c34f46e"},
  "body": "Prefers explicit comparison before irreversible choices.",
  "status": "active",
  "classification": "private",
  "provenance": {"source_event_ids": ["018f0f6f-a3d2-7d09-bd19-d6325d4bc77a"], "derivation": {"kind": "model_proposal", "producer": "local-profile:summary", "proposal_id": "018f0f70-162f-77cd-b64d-9d92e31d8b71", "policy_version": "memory-policy/1"}},
  "created_at": "2026-08-30T16:04:00.000Z",
  "created_by": "harness"
}
