{
  "contract_version": "1.0",
  "record_id": "018f0f70-9a8c-75dc-b6bf-dfe68dbe71bd",
  "revision_id": "018f0f70-a2c4-7ff8-972a-30543e84b43c",
  "revision": 1,
  "room_id": "018f0f6e-7b6a-7c10-8af1-7f4c620b93c1",
  "kind": "room",
  "scope": {},
  "body": "Decisions in this room use a compare-then-choose convention.",
  "status": "active",
  "classification": "exportable",
  "provenance": {"source_event_ids": ["018f0f6f-a3d2-7d09-bd19-d6325d4bc77a"], "derivation": {"kind": "human_edit", "producer": "human", "policy_version": "memory-policy/1"}},
  "created_at": "2026-08-30T16:04:00.000Z",
  "created_by": "user"
}
